[
  {
    "discontinued_id": "DISC_CAT_001",
    "category_name": "Legacy Retired Category 1",
    "final_active_ceremony_edition": 53,
    "cumulative_years_active": 15,
    "retirement_rationale": "Consolidation of gendered vocal awards into gender-neutral categories",
    "merged_into_category_id": "CAT_RECORD_OF_THE_YEAR_000",
    "total_winners_awarded": 15,
    "total_nominations_recorded": 75,
    "historic_significance_tag": "Gender-Neutral Reform 2012",
    "archive_vault_reference": "ARCHIVE_DOC_BOX_100"
  },
  {
    "discontinued_id": "DISC_CAT_002",
    "category_name": "Legacy Retired Category 2",
    "final_active_ceremony_edition": 53,
    "cumulative_years_active": 16,
    "retirement_rationale": "Consolidation of gendered vocal awards into gender-neutral categories",
    "merged_into_category_id": "CAT_ALBUM_OF_THE_YEAR_001",
    "total_winners_awarded": 16,
    "total_nominations_recorded": 76,
    "historic_significance_tag": "Gender-Neutral Reform 2012",
    "archive_vault_reference": "ARCHIVE_DOC_BOX_101"
  },
  {
    "discontinued_id": "DISC_CAT_003",
    "category_name": "Legacy Retired Category 3",
    "final_active_ceremony_edition": 53,
    "cumulative_years_active": 17,
    "retirement_rationale": "Consolidation of gendered vocal awards into gender-neutral categories",
    "merged_into_category_id": "CAT_SONG_OF_THE_YEAR_002",
    "total_winners_awarded": 17,
    "total_nominations_recorded": 77,
    "historic_significance_tag": "Gender-Neutral Reform 2012",
    "archive_vault_reference": "ARCHIVE_DOC_BOX_102"
  },
  {
    "discontinued_id": "DISC_CAT_004",
    "category_name": "Legacy Retired Category 4",
    "final_active_ceremony_edition": 53,
    "cumulative_years_active": 18,
    "retirement_rationale": "Consolidation of gendered vocal awards into gender-neutral categories",
    "merged_into_category_id": "CAT_BEST_VOCAL_PERFORMANCE_FEMALE_003",
    "total_winners_awarded": 18,
    "total_nominations_recorded": 78,
    "historic_significance_tag": "Gender-Neutral Reform 2012",
    "archive_vault_reference": "ARCHIVE_DOC_BOX_103"
  },
  {
    "discontinued_id": "DISC_CAT_005",
    "category_name": "Legacy Retired Category 5",
    "final_active_ceremony_edition": 53,
    "cumulative_years_active": 19,
    "retirement_rationale": "Consolidation of gendered vocal awards into gender-neutral categories",
    "merged_into_category_id": "CAT_BEST_VOCAL_PERFORMANCE_MALE_004",
    "total_winners_awarded": 19,
    "total_nominations_recorded": 79,
    "historic_significance_tag": "Gender-Neutral Reform 2012",
    "archive_vault_reference": "ARCHIVE_DOC_BOX_104"
  },
  {
    "discontinued_id": "DISC_CAT_006",
    "category_name": "Legacy Retired Category 6",
    "final_active_ceremony_edition": 53,
    "cumulative_years_active": 20,
    "retirement_rationale": "Consolidation of gendered vocal awards into gender-neutral categories",
    "merged_into_category_id": "CAT_BEST_PERFORMANCE_BY_AN_ORCHEST_005",
    "total_winners_awarded": 20,
    "total_nominations_recorded": 80,
    "historic_significance_tag": "Gender-Neutral Reform 2012",
    "archive_vault_reference": "ARCHIVE_DOC_BOX_105"
  },
  {
    "discontinued_id": "DISC_CAT_007",
    "category_name": "Legacy Retired Category 7",
    "final_active_ceremony_edition": 53,
    "cumulative_years_active": 21,
    "retirement_rationale": "Consolidation of gendered vocal awards into gender-neutral categories",
    "merged_into_category_id": "CAT_BEST_PERFORMANCE_BY_A_DANCE_BA_006",
    "total_winners_awarded": 21,
    "total_nominations_recorded": 81,
    "historic_significance_tag": "Gender-Neutral Reform 2012",
    "archive_vault_reference": "ARCHIVE_DOC_BOX_106"
  },
  {
    "discontinued_id": "DISC_CAT_008",
    "category_name": "Legacy Retired Category 8",
    "final_active_ceremony_edition": 53,
    "cumulative_years_active": 22,
    "retirement_rationale": "Consolidation of gendered vocal awards into gender-neutral categories",
    "merged_into_category_id": "CAT_BEST_PERFORMANCE_BY_A_VOCAL_GR_007",
    "total_winners_awarded": 22,
    "total_nominations_recorded": 82,
    "historic_significance_tag": "Gender-Neutral Reform 2012",
    "archive_vault_reference": "ARCHIVE_DOC_BOX_107"
  },
  {
    "discontinued_id": "DISC_CAT_009",
    "category_name": "Legacy Retired Category 9",
    "final_active_ceremony_edition": 53,
    "cumulative_years_active": 23,
    "retirement_rationale": "Consolidation of gendered vocal awards into gender-neutral categories",
    "merged_into_category_id": "CAT_BEST_JAZZ_PERFORMANCE_INDIVIDU_008",
    "total_winners_awarded": 23,
    "total_nominations_recorded": 83,
    "historic_significance_tag": "Gender-Neutral Reform 2012",
    "archive_vault_reference": "ARCHIVE_DOC_BOX_108"
  },
  {
    "discontinued_id": "DISC_CAT_010",
    "category_name": "Legacy Retired Category 10",
    "final_active_ceremony_edition": 53,
    "cumulative_years_active": 24,
    "retirement_rationale": "Consolidation of gendered vocal awards into gender-neutral categories",
    "merged_into_category_id": "CAT_BEST_JAZZ_PERFORMANCE_GROUP_009",
    "total_winners_awarded": 24,
    "total_nominations_recorded": 84,
    "historic_significance_tag": "Gender-Neutral Reform 2012",
    "archive_vault_reference": "ARCHIVE_DOC_BOX_109"
  },
  {
    "discontinued_id": "DISC_CAT_011",
    "category_name": "Legacy Retired Category 11",
    "final_active_ceremony_edition": 53,
    "cumulative_years_active": 25,
    "retirement_rationale": "Consolidation of gendered vocal awards into gender-neutral categories",
    "merged_into_category_id": "CAT_BEST_COMEDY_PERFORMANCE_010",
    "total_winners_awarded": 25,
    "total_nominations_recorded": 85,
    "historic_significance_tag": "Gender-Neutral Reform 2012",
    "archive_vault_reference": "ARCHIVE_DOC_BOX_110"
  },
  {
    "discontinued_id": "DISC_CAT_012",
    "category_name": "Legacy Retired Category 12",
    "final_active_ceremony_edition": 53,
    "cumulative_years_active": 26,
    "retirement_rationale": "Consolidation of gendered vocal awards into gender-neutral categories",
    "merged_into_category_id": "CAT_BEST_COUNTRY_WESTERN_PERFORMAN_011",
    "total_winners_awarded": 26,
    "total_nominations_recorded": 86,
    "historic_significance_tag": "Gender-Neutral Reform 2012",
    "archive_vault_reference": "ARCHIVE_DOC_BOX_111"
  },
  {
    "discontinued_id": "DISC_CAT_013",
    "category_name": "Legacy Retired Category 13",
    "final_active_ceremony_edition": 53,
    "cumulative_years_active": 27,
    "retirement_rationale": "Consolidation of gendered vocal awards into gender-neutral categories",
    "merged_into_category_id": "CAT_BEST_RHYTHM_BLUES_PERFORMANCE_012",
    "total_winners_awarded": 27,
    "total_nominations_recorded": 87,
    "historic_significance_tag": "Gender-Neutral Reform 2012",
    "archive_vault_reference": "ARCHIVE_DOC_BOX_112"
  },
  {
    "discontinued_id": "DISC_CAT_014",
    "category_name": "Legacy Retired Category 14",
    "final_active_ceremony_edition": 53,
    "cumulative_years_active": 28,
    "retirement_rationale": "Consolidation of gendered vocal awards into gender-neutral categories",
    "merged_into_category_id": "CAT_BEST_ARRANGEMENT_013",
    "total_winners_awarded": 28,
    "total_nominations_recorded": 88,
    "historic_significance_tag": "Gender-Neutral Reform 2012",
    "archive_vault_reference": "ARCHIVE_DOC_BOX_113"
  },
  {
    "discontinued_id": "DISC_CAT_015",
    "category_name": "Legacy Retired Category 15",
    "final_active_ceremony_edition": 53,
    "cumulative_years_active": 29,
    "retirement_rationale": "Consolidation of gendered vocal awards into gender-neutral categories",
    "merged_into_category_id": "CAT_BEST_ENGINEERED_RECORD_CLASSIC_014",
    "total_winners_awarded": 29,
    "total_nominations_recorded": 89,
    "historic_significance_tag": "Gender-Neutral Reform 2012",
    "archive_vault_reference": "ARCHIVE_DOC_BOX_114"
  },
  {
    "discontinued_id": "DISC_CAT_016",
    "category_name": "Legacy Retired Category 16",
    "final_active_ceremony_edition": 53,
    "cumulative_years_active": 30,
    "retirement_rationale": "Consolidation of gendered vocal awards into gender-neutral categories",
    "merged_into_category_id": "CAT_BEST_ENGINEERED_RECORD_NON_CLA_015",
    "total_winners_awarded": 30,
    "total_nominations_recorded": 90,
    "historic_significance_tag": "Gender-Neutral Reform 2012",
    "archive_vault_reference": "ARCHIVE_DOC_BOX_115"
  },
  {
    "discontinued_id": "DISC_CAT_017",
    "category_name": "Legacy Retired Category 17",
    "final_active_ceremony_edition": 53,
    "cumulative_years_active": 31,
    "retirement_rationale": "Consolidation of gendered vocal awards into gender-neutral categories",
    "merged_into_category_id": "CAT_BEST_ALBUM_COVER_016",
    "total_winners_awarded": 31,
    "total_nominations_recorded": 91,
    "historic_significance_tag": "Gender-Neutral Reform 2012",
    "archive_vault_reference": "ARCHIVE_DOC_BOX_116"
  },
  {
    "discontinued_id": "DISC_CAT_018",
    "category_name": "Legacy Retired Category 18",
    "final_active_ceremony_edition": 53,
    "cumulative_years_active": 32,
    "retirement_rationale": "Consolidation of gendered vocal awards into gender-neutral categories",
    "merged_into_category_id": "CAT_BEST_MUSICAL_COMPOSITION_FIRST_017",
    "total_winners_awarded": 32,
    "total_nominations_recorded": 92,
    "historic_significance_tag": "Gender-Neutral Reform 2012",
    "archive_vault_reference": "ARCHIVE_DOC_BOX_117"
  },
  {
    "discontinued_id": "DISC_CAT_019",
    "category_name": "Legacy Retired Category 19",
    "final_active_ceremony_edition": 53,
    "cumulative_years_active": 33,
    "retirement_rationale": "Consolidation of gendered vocal awards into gender-neutral categories",
    "merged_into_category_id": "CAT_BEST_ORIGINAL_CAST_ALBUM_BROAD_018",
    "total_winners_awarded": 33,
    "total_nominations_recorded": 93,